# USBSWITCH=0 (Default configuration)
T:  Bus=02 Lev=02 Prnt=02 Port=02 Cnt=01 Dev#= 15 Spd=5000 MxCh= 0
D:  Ver= 3.00 Cls=ef(misc ) Sub=02 Prot=01 MxPS= 9 #Cfgs=  3
P:  Vendor=1bc7 ProdID=1900 Rev=03.10
S:  Manufacturer=Telit
S:  Product=Telit LN940 Mobile Broadband
S:  SerialNumber=0123456789ABCDEF
## Cfg#=1
C:  #Ifs= 5 Cfg#= 1 Atr=a0 MxPwr=504mA
I:  If#= 0 Alt= 0 #EPs= 2 Cls=ff(vend.) Sub=ff Prot=ff Driver=option
I:  If#= 1 Alt= 0 #EPs= 3 Cls=ff(vend.) Sub=ff Prot=ff Driver=qmi_wwan
I:  If#= 2 Alt= 0 #EPs= 3 Cls=ff(vend.) Sub=00 Prot=00 Driver=option
I:  If#= 3 Alt= 0 #EPs= 3 Cls=ff(vend.) Sub=00 Prot=00 Driver=option
I:  If#= 4 Alt= 0 #EPs= 3 Cls=ff(vend.) Sub=00 Prot=00 Driver=option
## Cfg#=2
T:  Bus=02 Lev=02 Prnt=02 Port=02 Cnt=01 Dev#= 15 Spd=5000 MxCh= 0
D:  Ver= 3.00 Cls=ef(misc ) Sub=02 Prot=01 MxPS= 9 #Cfgs=  3
P:  Vendor=1bc7 ProdID=1900 Rev=03.10
S:  Manufacturer=Telit
S:  Product=Telit LN940 Mobile Broadband
S:  SerialNumber=0123456789ABCDEF
C:  #Ifs= 2 Cfg#= 2 Atr=a0 MxPwr=504mA
I:  If#= 0 Alt= 0 #EPs= 1 Cls=02(commc) Sub=06 Prot=00 Driver=cdc_ether
I:  If#= 1 Alt= 1 #EPs= 2 Cls=0a(data ) Sub=00 Prot=00 Driver=cdc_ether
## Cfg#=3
T:  Bus=02 Lev=02 Prnt=02 Port=02 Cnt=01 Dev#= 15 Spd=5000 MxCh= 0
D:  Ver= 3.00 Cls=ef(misc ) Sub=02 Prot=01 MxPS= 9 #Cfgs=  3
P:  Vendor=1bc7 ProdID=1900 Rev=03.10
S:  Manufacturer=Telit
S:  Product=Telit LN940 Mobile Broadband
S:  SerialNumber=0123456789ABCDEF
C:  #Ifs= 3 Cfg#= 3 Atr=a0 MxPwr=504mA
I:  If#= 0 Alt= 0 #EPs= 1 Cls=02(commc) Sub=0e Prot=00 Driver=cdc_mbim
I:  If#= 1 Alt= 1 #EPs= 2 Cls=0a(data ) Sub=00 Prot=02 Driver=cdc_mbim
I:  If#= 2 Alt= 0 #EPs= 1 Cls=ff(vend.) Sub=ff Prot=ff Driver=option

# USBSWITCH=1
T:  Bus=02 Lev=02 Prnt=02 Port=02 Cnt=01 Dev#= 13 Spd=5000 MxCh= 0
D:  Ver= 3.00 Cls=ef(misc ) Sub=02 Prot=01 MxPS= 9 #Cfgs=  1
P:  Vendor=1bc7 ProdID=1901 Rev=03.10
S:  Manufacturer=Telit
S:  Product=Telit LN940 Mobile Broadband
S:  SerialNumber=0123456789ABCDEF
C:  #Ifs= 6 Cfg#= 1 Atr=a0 MxPwr=504mA
I:  If#= 0 Alt= 0 #EPs= 2 Cls=ff(vend.) Sub=ff Prot=ff Driver=option
I:  If#= 1 Alt= 0 #EPs= 3 Cls=ff(vend.) Sub=00 Prot=00 Driver=option
I:  If#= 2 Alt= 0 #EPs= 3 Cls=ff(vend.) Sub=00 Prot=00 Driver=option
I:  If#= 3 Alt= 0 #EPs= 3 Cls=ff(vend.) Sub=00 Prot=00 Driver=option
I:  If#= 4 Alt= 0 #EPs= 1 Cls=02(commc) Sub=0e Prot=00 Driver=cdc_mbim
I:  If#= 5 Alt= 1 #EPs= 2 Cls=0a(data ) Sub=00 Prot=02 Driver=cdc_mbim

# USBSWITCH=2
T:  Bus=02 Lev=02 Prnt=02 Port=02 Cnt=01 Dev#= 11 Spd=5000 MxCh= 0
D:  Ver= 3.00 Cls=ef(misc ) Sub=02 Prot=01 MxPS= 9 #Cfgs=  1
P:  Vendor=1bc7 ProdID=1900 Rev=03.10
S:  Manufacturer=Telit
S:  Product=Telit LN940 Mobile Broadband
S:  SerialNumber=0123456789ABCDEF
C:  #Ifs= 5 Cfg#= 1 Atr=a0 MxPwr=504mA
I:  If#= 0 Alt= 0 #EPs= 2 Cls=ff(vend.) Sub=ff Prot=ff Driver=option
I:  If#= 1 Alt= 0 #EPs= 3 Cls=ff(vend.) Sub=ff Prot=ff Driver=qmi_wwan
I:  If#= 2 Alt= 0 #EPs= 3 Cls=ff(vend.) Sub=00 Prot=00 Driver=option
I:  If#= 3 Alt= 0 #EPs= 3 Cls=ff(vend.) Sub=00 Prot=00 Driver=option
I:  If#= 4 Alt= 0 #EPs= 3 Cls=ff(vend.) Sub=00 Prot=00 Driver=option
