# USBSWITCH=0 (Default configuration)
T:  Bus=02 Lev=02 Prnt=02 Port=02 Cnt=01 Dev#=  9 Spd=5000 MxCh= 0
D:  Ver= 3.10 Cls=ef(misc ) Sub=02 Prot=01 MxPS= 9 #Cfgs=  2
P:  Vendor=1bc7 ProdID=1910 Rev=03.18
S:  Manufacturer=Telit
S:  Product=Telit LN960 Mobile Broadband
S:  SerialNumber=0123456789ABCDEF
C:  #Ifs= 6 Cfg#= 1 Atr=a0 MxPwr=896mA
I:  If#= 0 Alt= 0 #EPs= 3 Cls=ff(vend.) Sub=ff Prot=ff Driver=qmi_wwan
I:  If#= 1 Alt= 0 #EPs= 1 Cls=03(HID  ) Sub=00 Prot=00 Driver=usbhid
I:  If#= 2 Alt= 0 #EPs= 3 Cls=ff(vend.) Sub=00 Prot=00 Driver=option
I:  If#= 3 Alt= 0 #EPs= 3 Cls=ff(vend.) Sub=00 Prot=00 Driver=option
I:  If#= 4 Alt= 0 #EPs= 3 Cls=ff(vend.) Sub=00 Prot=00 Driver=option
I:  If#= 5 Alt= 0 #EPs= 2 Cls=ff(vend.) Sub=ff Prot=ff Driver=option

T:  Bus=02 Lev=02 Prnt=02 Port=02 Cnt=01 Dev#=  9 Spd=5000 MxCh= 0
D:  Ver= 3.10 Cls=ef(misc ) Sub=02 Prot=01 MxPS= 9 #Cfgs=  2
P:  Vendor=1bc7 ProdID=1910 Rev=03.18
S:  Manufacturer=Telit
S:  Product=Telit LN960 Mobile Broadband
S:  SerialNumber=0123456789ABCDEF
C:  #Ifs= 7 Cfg#= 2 Atr=a0 MxPwr=896mA
I:  If#= 0 Alt= 0 #EPs= 1 Cls=02(commc) Sub=0e Prot=00 Driver=cdc_mbim
I:  If#= 1 Alt= 1 #EPs= 2 Cls=0a(data ) Sub=00 Prot=02 Driver=cdc_mbim
I:  If#= 2 Alt= 0 #EPs= 3 Cls=ff(vend.) Sub=00 Prot=00 Driver=option
I:  If#= 3 Alt= 0 #EPs= 3 Cls=ff(vend.) Sub=00 Prot=00 Driver=option
I:  If#= 4 Alt= 0 #EPs= 3 Cls=ff(vend.) Sub=00 Prot=00 Driver=option
I:  If#= 5 Alt= 0 #EPs= 2 Cls=ff(vend.) Sub=ff Prot=ff Driver=option
I:  If#= 6 Alt= 0 #EPs= 1 Cls=ff(vend.) Sub=ff Prot=ff Driver=(none)

# USBSWITCH=1
T:  Bus=02 Lev=02 Prnt=02 Port=02 Cnt=01 Dev#=  7 Spd=5000 MxCh= 0
D:  Ver= 3.10 Cls=ef(misc ) Sub=02 Prot=01 MxPS= 9 #Cfgs=  1
P:  Vendor=1bc7 ProdID=1911 Rev=03.18
S:  Manufacturer=Telit
S:  Product=Telit LN960 Mobile Broadband
S:  SerialNumber=0123456789ABCDEF
C:  #Ifs= 6 Cfg#= 1 Atr=a0 MxPwr=896mA
I:  If#= 0 Alt= 0 #EPs= 2 Cls=ff(vend.) Sub=ff Prot=ff Driver=option
I:  If#= 1 Alt= 0 #EPs= 3 Cls=ff(vend.) Sub=00 Prot=00 Driver=option
I:  If#= 2 Alt= 0 #EPs= 3 Cls=ff(vend.) Sub=00 Prot=00 Driver=option
I:  If#= 3 Alt= 0 #EPs= 3 Cls=ff(vend.) Sub=00 Prot=00 Driver=option
I:  If#= 4 Alt= 0 #EPs= 1 Cls=02(commc) Sub=0e Prot=00 Driver=cdc_mbim
I:  If#= 5 Alt= 1 #EPs= 2 Cls=0a(data ) Sub=00 Prot=02 Driver=cdc_mbim

